{
  "title": "연무동에서 저녁 같이 해볼 4명 모임 안내",
  "description": "연무동 근처에서 퇴근 후 저녁 같이 드실 4명을 찾고 있어요. 저도 동네에서 가볍게 지내는 또래라, 거창한 모임이라기보다는 편하게 한 끼 같이 해보는 자리예요. 처음 오시는 분도 부담 없이 오실 수 있게 호스트가 먼저 인사부터 건네요. 메뉴는 당일 분위기 봐서 같이 정할게요. 관심 있으신 분 편하게 신청 부탁드려요.",
  "activity_purpose": "동네에서 같이 저녁 먹으면서 가볍게 얼굴 익히는 자리예요",
  "progress_style": "19시쯤 식당 앞에서 모여서 같이 들어가고, 주문하면서 간단히 인사 나누고, 편안하게 식사하면서 대화하고 마무리해요",
  "materials": [],
  "target_audience": "초면 모임이 괜찮고 연무동 근처에서 편하게 저녁 드실 분",
  "cost_breakdown": [
    {"item": "식사비 (1인)", "amount": 16000},
    {"item": "음료 (1인)", "amount": 2000}
  ],
  "host_intro": "연무동에서 3년째 살고 있는 또래 호스트예요. 저도 프로 강사는 아니고 그냥 동네 이웃 찾는 마음으로 열어봤어요. 처음 오시는 분도 금방 편해지실 수 있게 도와드릴게요.",
  "policy_notes": "당일 취소는 다음 모임 신청이 제한될 수 있어요. 실비는 계산서 공유해드려요."
}
