{
  "title": "연무동 저녁 한 끼 같이할 4명 모집 - 취향이 통하는 소규모 식사 모임",
  "description": "퇴근 후 혼자 먹기 아쉬운 저녁, 연무동 근처에서 취향이 맞는 4명이 가볍게 모여 식사하는 모임이에요. 부담 없는 분위기에서 오늘 있었던 이야기, 요즘 관심 있는 것들을 나누다 보면 어느새 친해져 있을 거예요. 처음 오시는 분도 어색하지 않게 진행하니 편하게 신청해 주세요.",
  "activity_purpose": "퇴근 후 가볍게 식사하며 연무동 이웃과 취향을 나누는 것",
  "progress_style": "19:00 장소 집결 후 간단히 인사, 메뉴 주문, 자유로운 식사와 대화, 마무리 취향 공유 순으로 진행합니다. 호스트가 어색한 침묵이 없도록 부드럽게 대화를 이끌어요.",
  "materials": [],
  "target_audience": "연무동 근처 직장인/거주자 중 초면 모임이 괜찮은 분",
  "cost_breakdown": [
    {"item": "식사비 (1인)", "amount": 16000},
    {"item": "음료/차 (1인)", "amount": 2000}
  ],
  "host_intro": "연무동에서 3년째 살고 있는 supporter_teacher 호스트예요. 평소 동네 맛집 탐방이 취미라 편안한 자리를 만들어 드릴게요. 처음 오시는 분도 금방 적응하실 수 있어요.",
  "policy_notes": "당일 노쇼는 다음 모집부터 참여가 제한될 수 있어요."
}
